n,StartDate,EndDate,Status,IPAddress,Progress,Duration (in seconds),Finished,RecordedDate,ResponseId,RecipientLastName,RecipientFirstName,RecipientEmail,ExternalReference,LocationLatitude,LocationLongitude,DistributionChannel,UserLanguage,Instructions,Gender,Gender_3_TEXT,Age,Q218,Q219,Ethnicity,White background,White background_8_TEXT,Mixed background,Mixed background_8_TEXT,Asian background,Asian background_12_TEXT,Black background,Black background_9_TEXT,Other background,Other background_15_TEXT,Education,Language,MultiLg,Condition,instru_open_uk_time_First Click,instru_open_uk_time_Last Click,instru_open_uk_time_Page Submit,instru_open_uk_time_Click Count,op1_uk_coor,op1_uk_coor_time_First Click,op1_uk_coor_time_Last Click,op1_uk_coor_time_Page Submit,op1_uk_coor_time_Click Count,op2_uk_coor,op2_uk_coor_time_First Click,op2_uk_coor_time_Last Click,op2_uk_coor_time_Page Submit,op2_uk_coor_time_Click Count,op3_uk_coor,op3_uk_coor_time_First Click,op3_uk_coor_time_Last Click,op3_uk_coor_time_Page Submit,op3_uk_coor_time_Click Count,op4_uk_coor,op4_uk_coor_time_First Click,op4_uk_coor_time_Last Click,op4_uk_coor_time_Page Submit,op4_uk_coor_time_Click Count,op5_uk_coor,op5_uk_coor_time_First Click,op5_uk_coor_time_Last Click,op5_uk_coor_time_Page Submit,op5_uk_coor_time_Click Count,op6_uk_coor,op6_uk_coor_time_First Click,op6_uk_coor_time_Last Click,op6_uk_coor_time_Page Submit,op6_uk_coor_time_Click Count,op7_uk_coor,op7_uk_coor_time_First Click,op7_uk_coor_time_Last Click,op7_uk_coor_time_Page Submit,op7_uk_coor_time_Click Count,op8_uk_coor,op8_uk_coor_time_First Click,op8_uk_coor_time_Last Click,op8_uk_coor_time_Page Submit,op8_uk_coor_time_Click Count,op9_uk_coor,op9_uk_coor_time_First Click,op9_uk_coor_time_Last Click,op9_uk_coor_time_Page Submit,op9_uk_coor_time_Click Count,op10_uk_coor,op10_uk_coor_time_First Click,op10_uk_coor_time_Last Click,op10_uk_coor_time_Page Submit,op10_uk_coor_time_Click Count,op11_uk_coor,op11_uk_coor_time_First Click,op11_uk_coor_time_Last Click,op11_uk_coor_time_Page Submit,op11_uk_coor_time_Click Count,op12_uk_coor,op12_uk_coor_time _First Click,op12_uk_coor_time _Last Click,op12_uk_coor_time _Page Submit,op12_uk_coor_time _Click Count,op13_uk_coor ,op13_uk_coor_time _First Click,op13_uk_coor_time _Last Click,op13_uk_coor_time _Page Submit,op13_uk_coor_time _Click Count,op14_uk_coor ,op14_uk_coor_time _First Click,op14_uk_coor_time _Last Click,op14_uk_coor_time _Page Submit,op14_uk_coor_time _Click Count,op15_uk_coor,op15_uk_coor_time _First Click,op15_uk_coor_time _Last Click,op15_uk_coor_time _Page Submit,op15_uk_coor_time _Click Count,op16_uk_coor,op16_uk_coor_time _First Click,op16_uk_coor_time _Last Click,op16_uk_coor_time _Page Submit,op16_uk_coor_time _Click Count,op17_uk_coor,op17_uk_coor_time _First Click,op17_uk_coor_time _Last Click,op17_uk_coor_time _Page Submit,op17_uk_coor_time _Click Count,op18_uk_coor,op18_uk_coor_time _First Click,op18_uk_coor_time _Last Click,op18_uk_coor_time _Page Submit,op18_uk_coor_time _Click Count,op19_uk_coor,op19_uk_coor_time _First Click,op19_uk_coor_time _Last Click,op19_uk_coor_time _Page Submit,op19_uk_coor_time _Click Count,op20_uk_coor,op20_uk_coor_time _First Click,op20_uk_coor_time _Last Click,op20_uk_coor_time _Page Submit,op20_uk_coor_time _Click Count,op21_uk_coor,op21_uk_coor_time _First Click,op21_uk_coor_time _Last Click,op21_uk_coor_time _Page Submit,op21_uk_coor_time _Click Count,op22_uk_coor,op22_uk_coor_time _First Click,op22_uk_coor_time _Last Click,op22_uk_coor_time _Page Submit,op22_uk_coor_time _Click Count,op23_uk_coor,op23_uk_coor_time _First Click,op23_uk_coor_time _Last Click,op23_uk_coor_time _Page Submit,op23_uk_coor_time _Click Count,op24_uk_coor,op24_uk_coor_time _First Click,op24_uk_coor_time _Last Click,op24_uk_coor_time _Page Submit,op24_uk_coor_time _Click Count,op25_uk_coor,op25_uk_coor_time _First Click,op25_uk_coor_time _Last Click,op25_uk_coor_time _Page Submit,op25_uk_coor_time _Click Count,op26_uk_coor,op26_uk_coor_time _First Click,op26_uk_coor_time _Last Click,op26_uk_coor_time _Page Submit,op26_uk_coor_time _Click Count,op27_uk_coor,op27_uk_coor_time_First Click,op27_uk_coor_time_Last Click,op27_uk_coor_time_Page Submit,op27_uk_coor_time_Click Count,op28_uk_coor,op28_uk_coor_time _First Click,op28_uk_coor_time _Last Click,op28_uk_coor_time _Page Submit,op28_uk_coor_time _Click Count,op29_uk_coor,op29_uk_coor_time _First Click,op29_uk_coor_time _Last Click,op29_uk_coor_time _Page Submit,op29_uk_coor_time _Click Count,op30_uk_coor,op30_uk_coor_time _First Click,op30_uk_coor_time _Last Click,op30_uk_coor_time _Page Submit,op30_uk_coor_time _Click Count,check_item_uk,instru_open_uk_time _First Click,instru_open_uk_time _Last Click,instru_open_uk_time _Page Submit,instru_open_uk_time _Click Count,op1_unkw_coor ,op1_unkw_coor_time _First Click,op1_unkw_coor_time _Last Click,op1_unkw_coor_time _Page Submit,op1_unkw_coor_time _Click Count,op2_unkw_coor ,op2_unkw_coor_time _First Click,op2_unkw_coor_time _Last Click,op2_unkw_coor_time _Page Submit,op2_unkw_coor_time _Click Count,op3_unkw_coor ,op3_unkw_coor_time _First Click,op3_unkw_coor_time _Last Click,op3_unkw_coor_time _Page Submit,op3_unkw_coor_time _Click Count,op4_unkw_coor ,op4_unkw_coor_time _First Click,op4_unkw_coor_time _Last Click,op4_unkw_coor_time _Page Submit,op4_unkw_coor_time _Click Count,op5_unkw_coor ,op5_unkw_coor_time _First Click,op5_unkw_coor_time _Last Click,op5_unkw_coor_time _Page Submit,op5_unkw_coor_time _Click Count,op6_unkw_coor ,op6_unkw_coor_time _First Click,op6_unkw_coor_time _Last Click,op6_unkw_coor_time _Page Submit,op6_unkw_coor_time _Click Count,op7_unkw_coor ,op7_unkw_coor_time _First Click,op7_unkw_coor_time _Last Click,op7_unkw_coor_time _Page Submit,op7_unkw_coor_time _Click Count,op8_unkw_coor ,op8_unkw_coor_time _First Click,op8_unkw_coor_time _Last Click,op8_unkw_coor_time _Page Submit,op8_unkw_coor_time _Click Count,op9_unkw_coor,op9_unkw_coor_time _First Click,op9_unkw_coor_time _Last Click,op9_unkw_coor_time _Page Submit,op9_unkw_coor_time _Click Count,op10_unkw_coor ,op10_unkw_coor_time _First Click,op10_unkw_coor_time _Last Click,op10_unkw_coor_time _Page Submit,op10_unkw_coor_time _Click Count,op11_unkw_coor_time ,op11_unkw_coor_time _First Click,op11_unkw_coor_time _Last Click,op11_unkw_coor_time _Page Submit,op11_unkw_coor_time _Click Count,op12_unkw_coor ,op12_unkw_coor_time _First Click,op12_unkw_coor_time _Last Click,op12_unkw_coor_time _Page Submit,op12_unkw_coor_time _Click Count,op13_unkw_coor ,op13_unkw_coor_time _First Click,op13_unkw_coor_time _Last Click,op13_unkw_coor_time _Page Submit,op13_unkw_coor_time _Click Count,op14_unkw_coor ,op14_unkw_coor_time _First Click,op14_unkw_coor_time _Last Click,op14_unkw_coor_time _Page Submit,op14_unkw_coor_time _Click Count,op15_unkw_coor ,op15_unkw_coor_time _First Click,op15_unkw_coor_time _Last Click,op15_unkw_coor_time _Page Submit,op15_unkw_coor_time _Click Count,op16_unkw_coor ,op16_unkw_coor_time _First Click,op16_unkw_coor_time _Last Click,op16_unkw_coor_time _Page Submit,op16_unkw_coor_time _Click Count,op17_unkw_coor ,op17_unkw_coor_time _First Click,op17_unkw_coor_time _Last Click,op17_unkw_coor_time _Page Submit,op17_unkw_coor_time _Click Count,op18_unkw_coor ,op18_unkw_coor_time _First Click,op18_unkw_coor_time _Last Click,op18_unkw_coor_time _Page Submit,op18_unkw_coor_time _Click Count,op19_unkw_coor ,op19_unkw_coor_time_First Click,op19_unkw_coor_time_Last Click,op19_unkw_coor_time_Page Submit,op19_unkw_coor_time_Click Count,op20_unkw_coor,op20_unkw_coor_time_First Click,op20_unkw_coor_time_Last Click,op20_unkw_coor_time_Page Submit,op20_unkw_coor_time_Click Count,op21_unkw_coor,op21_unkw_coor_time_First Click,op21_unkw_coor_time_Last Click,op21_unkw_coor_time_Page Submit,op21_unkw_coor_time_Click Count,op22_unkw_coor ,op22_unkw_coor_time _First Click,op22_unkw_coor_time _Last Click,op22_unkw_coor_time _Page Submit,op22_unkw_coor_time _Click Count,op23_unkw_coor ,op23_unkw_coor_time _First Click,op23_unkw_coor_time _Last Click,op23_unkw_coor_time _Page Submit,op23_unkw_coor_time _Click Count,op24_unkw_coor ,op24_unkw_coor_time _First Click,op24_unkw_coor_time _Last Click,op24_unkw_coor_time _Page Submit,op24_unkw_coor_time _Click Count,op25_unkw_coor ,op25_unkw_coor_time _First Click,op25_unkw_coor_time _Last Click,op25_unkw_coor_time _Page Submit,op25_unkw_coor_time _Click Count,op26_unkw_coor ,op26_unkw_coor_time _First Click,op26_unkw_coor_time _Last Click,op26_unkw_coor_time _Page Submit,op26_unkw_coor_time _Click Count,op27_unkw_coor ,op27_unkw_coor_time _First Click,op27_unkw_coor_time _Last Click,op27_unkw_coor_time _Page Submit,op27_unkw_coor_time _Click Count,op28_unkw_coor ,op28_unkw_coor_time _First Click,op28_unkw_coor_time _Last Click,op28_unkw_coor_time _Page Submit,op28_unkw_coor_time _Click Count,op29_unkw_coor ,op29_unkw_coor_time _First Click,op29_unkw_coor_time _Last Click,op29_unkw_coor_time _Page Submit,op29_unkw_coor_time _Click Count,op30_unkw_coor ,op30_unkw_coor_time_First Click,op30_unkw_coor_time_Last Click,op30_unkw_coor_time_Page Submit,op30_unkw_coor_time_Click Count,check_question_unkno,SC0,loo_world_world_item_1,loo_world_world_item_2,loo_world_world_item_3,loo_world_world_item_4,loo_world_world_item_5,loo_world_world_item_6,loo_world_world_item_7,loo_world_world_item_8,loo_world_world_item_9,loo_world_world_item_10,loo_world_world_item_11,loo_world_world_item_12,loo_world_world_item_13,loo_world_world_item_14,loo_world_world_item_15,loo_world_world_item_16,loo_world_world_item_17,loo_world_world_item_18,loo_world_world_item_19,loo_world_world_item_20,loo_world_world_item_21,loo_world_world_item_22,loo_world_world_item_23,loo_world_world_item_24,loo_world_world_item_25,loo_world_world_item_26,loo_world_world_item_27,loo_world_world_item_28,loo_world_world_item_29,loo_world_world_item_30,overall_world_sample_world_con,loo_world_brit_item_1,loo_world_brit_item_2,loo_world_brit_item_3,loo_world_brit_item_4,loo_world_brit_item_5,loo_world_brit_item_6,loo_world_brit_item_7,loo_world_brit_item_8,loo_world_brit_item_9,loo_world_brit_item_10,loo_world_brit_item_11,loo_world_brit_item_12,loo_world_brit_item_13,loo_world_brit_item_14,loo_world_brit_item_15,loo_world_brit_item_16,loo_world_brit_item_17,loo_world_brit_item_18,loo_world_brit_item_19,loo_world_brit_item_20,loo_world_brit_item_21,loo_world_brit_item_22,loo_world_brit_item_23,loo_world_brit_item_24,loo_world_brit_item_25,loo_world_brit_item_26,loo_world_brit_item_27,loo_world_brit_item_28,loo_world_brit_item_29,loo_world_brit_item_30,overall_int_sample_brit_con,crossed_brit_brit_item_1,crossed_brit_brit_item_2,crossed_brit_brit_item_3,crossed_brit_brit_item_4,crossed_brit_brit_item_5,crossed_brit_brit_item_6,crossed_brit_brit_item_7,crossed_brit_brit_item_8,crossed_brit_brit_item_9,crossed_brit_brit_item_10,crossed_brit_brit_item_11,crossed_brit_brit_item_13,crossed_brit_brit_item_14,crossed_brit_brit_item_15,crossed_brit_brit_item_16,crossed_brit_brit_item_17,crossed_brit_brit_item_18,crossed_brit_brit_item_19,crossed_brit_brit_item_20,crossed_brit_brit_item_22,crossed_brit_brit_item_23,crossed_brit_brit_item_24,crossed_brit_brit_item_25,crossed_brit_brit_item_26,crossed_brit_brit_item_27,crossed_brit_brit_item_28,crossed_brit_brit_item_29,crossed_brit_brit_item_30,crossed_brit_brit_item_12,crossed_brit_world_item_1,crossed_brit_world_item_2,crossed_brit_world_item_3,crossed_brit_world_item_4,crossed_brit_world_item_5,crossed_brit_world_item_6,crossed_brit_world_item_7,crossed_brit_world_item_8,crossed_brit_world_item_9,crossed_brit_world_item_10,crossed_brit_world_item_11,crossed_brit_world_item_12,crossed_brit_world_item_13,crossed_brit_world_item_14,crossed_brit_world_item_15,crossed_brit_world_item_16,crossed_brit_world_item_17,crossed_brit_world_item_18,crossed_brit_world_item_19,crossed_brit_world_item_20,crossed_brit_world_item_21,crossed_brit_world_item_22,crossed_brit_world_item_23,crossed_brit_world_item_24,crossed_brit_world_item_25,crossed_brit_world_item_26,crossed_brit_world_item_27,crossed_brit_world_item_28,crossed_brit_world_item_29,crossed_brit_world_item_30,crossed_brit_brit_item_21,overall_crossed_brit_to_int_sample_brit_con,overall_crossed_brit_to_int_sample_world_con
0,Start Date,End Date,Response Type,IP Address,Progress,Duration (in seconds),Finished,Recorded Date,Response ID,Recipient Last Name,Recipient First Name,Recipient Email,External Data Reference,Location Latitude,Location Longitude,Distribution Channel,User Language,"Welcome to the intuitive judgement study!  

 

Please read the following information before starting the study.

 

What is the purpose of this study? 

The purpose of this study is to investigate your intuitive judgements on questions where there may be no single “correct” answer.



What does this study involve? 

Your participation in this study may last up to 30 minutes. You will expected to complete a few  sociodemographic questions and a questionnaire with 30 questions.



To ensure the quality of survey data, your responses will be subject to sophisticated statistical control methods. Responding without much effort will be flagged for low-quality data. Though you will receive payment regardless of your data quality, please note that your honest and thoughtful responses are important to us and to the study. 

 

Other important items you should know



Benefits from participation: You will receive $4 for participating in this study. Additionally, you may experience indirect benefits (e.g. learning more about experimental psychology).





Risks associated with participation: Whilst participating in this study, you will encounter no greater risks of discomfort than found in routine daily activities.





Withdrawing from the study: Participation in this study is completely voluntary and you may choose to stop your participation at any time. You can also withdraw all or part of your data up to one month after participation by contacting the researchers (see below for contact details).





Data collection: The data collected in this study will include your responses in all sections of the survey, as well as basic demographic information. The data collected will be used only for the purpose described in this form. The raw data will only be available to the principal investigator listed in this consent form and other personnel involved in this study at the University of Birmingham.  During the data collection process, the data will be stored on Qualtrics' secure servers. When the data collection is complete, data will be stored on a secure computer. Once the study is complete, a copy of the anonymised data may be made available to journals to publish on their website to accompany publications arising from this study. Fully anonymised datasets may be shared with other researchers according to open access data sharing agreements. Data gathered from this study will be maintained as long as required by regulations: up to 10 years following the publication of empirical articles or communications describing the results of the study.





Confidentiality: Every effort will be taken to protect the names of the participants in this study. Your identity will not be recorded as part of your data, and will not be revealed in any publication that may result from this study; your consent form will not be stored with your data, to ensure that your identity cannot be linked in any way to your data. All information you provide will be kept confidential, except as governed by law.





Who should you contact if you have questions about this study? 



Daniel Perez-Zapata (principal investigator), School of Psychology, University of Birmingham, 

d.perezzapata@bham.ac.uk



Professor Ian Apperly (supervisor), School of Psychology, University of Birmingham, I.A.Apperly@bham.ac.uk





Selecting the ""I consent"" option, indicates that

- You have read the information above.

- You voluntarily agree to participate in this study and understand you can withdraw at any time.- You consent to anonymised versions of the study data being shared in the future.

- You are 18 years of age or older.",Gender - Selected Choice,Gender - I describe my gender in a different way (describe if you wish) - Text,Age (years):,Nationality:,What country do you live in?,Ethnicity. What is your ethnic background? (Please choose one option that best describes your ethnic group or background).,White White: - Selected Choice,White White: - Any other white background (please describe) - Text,Mixed Mixed / Multiple ethnic groups: - Selected Choice,Mixed Mixed / Multiple ethnic groups: - Any other mixed / multiple ethnic background (please describe) - Text,Asian Asian / Asian British: - Selected Choice,Asian Asian / Asian British: - Any other Asian background (please describe) - Text,Black Black / African / Caribbean / Black British: - Selected Choice,Black Black / African / Caribbean / Black British: - Any other Black / African / Caribbean background (please describe) - Text,Other Other ethnic group: - Selected Choice,Other Other ethnic group: - Any other ethnic group (please describe) - Text,What is the highest level of education you have completed?,Is English your native language?,"Based on the number of languages you are fluent in, do you consider yourself:",,Timing - First Click,Timing - Last Click,Timing - Page Submit,Timing - Click Count,name a wild animal:,Timing - First Click,Timing - Last Click,Timing - Page Submit,Timing - Click Count,name a female world leader:,Timing - First Click,Timing - Last Click,Timing - Page Submit,Timing - Click Count,name a popular dance:,Timing - First Click,Timing - Last Click,Timing - Page Submit,Timing - Click Count,name a landmark:,Timing - First Click,Timing - Last Click,Timing - Page Submit,Timing - Click Count,name a typical snack:,Timing - First Click,Timing - Last Click,Timing - Page Submit,Timing - Click Count,name a male singer:,Timing - First Click,Timing - Last Click,Timing - Page Submit,Timing - Click Count,name a typical drink:,Timing - First Click,Timing - Last Click,Timing - Page Submit,Timing - Click Count,name a city:,Timing - First Click,Timing - Last Click,Timing - Page Submit,Timing - Click Count,name a piece of art:,Timing - First Click,Timing - Last Click,Timing - Page Submit,Timing - Click Count,name a newspaper:,Timing - First Click,Timing - Last Click,Timing - Page Submit,Timing - Click Count,name a sport player (any sport):,Timing - First Click,Timing - Last Click,Timing - Page Submit,Timing - Click Count,name a world leader:,Timing - First Click,Timing - Last Click,Timing - Page Submit,Timing - Click Count,<bound method StringMethods.lower of <pandas.core.strings.accessor.StringMethods object at 0x7fc2a86e62b0>>,Timing - First Click,Timing - Last Click,Timing - Page Submit,Timing - Click Count,name a book:,Timing - First Click,Timing - Last Click,Timing - Page Submit,Timing - Click Count,name a television broadcasting organisation:,Timing - First Click,Timing - Last Click,Timing - Page Submit,Timing - Click Count,name a male football player:,Timing - First Click,Timing - Last Click,Timing - Page Submit,Timing - Click Count,name a cartoon:,Timing - First Click,Timing - Last Click,Timing - Page Submit,Timing - Click Count,name a recognisable chocolate brand:,Timing - First Click,Timing - Last Click,Timing - Page Submit,Timing - Click Count,name a music band:,Timing - First Click,Timing - Last Click,Timing - Page Submit,Timing - Click Count,name a date in the year:,Timing - First Click,Timing - Last Click,Timing - Page Submit,Timing - Click Count,name a mountain:,Timing - First Click,Timing - Last Click,Timing - Page Submit,Timing - Click Count,name a currency:,Timing - First Click,Timing - Last Click,Timing - Page Submit,Timing - Click Count,name a typical celebration:,Timing - First Click,Timing - Last Click,Timing - Page Submit,Timing - Click Count,name a female singer:,Timing - First Click,Timing - Last Click,Timing - Page Submit,Timing - Click Count,name a beach:,Timing - First Click,Timing - Last Click,Timing - Page Submit,Timing - Click Count,name a flight company:,Timing - First Click,Timing - Last Click,Timing - Page Submit,Timing - Click Count,name a typical dish:,Timing - First Click,Timing - Last Click,Timing - Page Submit,Timing - Click Count,name a typical flower:,Timing - First Click,Timing - Last Click,Timing - Page Submit,Timing - Click Count,name a sport:,Timing - First Click,Timing - Last Click,Timing - Page Submit,Timing - Click Count,name a tourist city:,Timing - First Click,Timing - Last Click,Timing - Page Submit,Timing - Click Count,Name the current president of the United States:,Timing - First Click,Timing - Last Click,Timing - Page Submit,Timing - Click Count,name a wild animal:,Timing - First Click,Timing - Last Click,Timing - Page Submit,Timing - Click Count,name a female world leader::,Timing - First Click,Timing - Last Click,Timing - Page Submit,Timing - Click Count,name a popular dance:,Timing - First Click,Timing - Last Click,Timing - Page Submit,Timing - Click Count,name a landmark:,Timing - First Click,Timing - Last Click,Timing - Page Submit,Timing - Click Count,name a typical snack:,Timing - First Click,Timing - Last Click,Timing - Page Submit,Timing - Click Count,name a male singer:,Timing - First Click,Timing - Last Click,Timing - Page Submit,Timing - Click Count,name a typical drink:,Timing - First Click,Timing - Last Click,Timing - Page Submit,Timing - Click Count,name a city:,Timing - First Click,Timing - Last Click,Timing - Page Submit,Timing - Click Count,name a piece of art:,Timing - First Click,Timing - Last Click,Timing - Page Submit,Timing - Click Count,name a newspaper:,Timing - First Click,Timing - Last Click,Timing - Page Submit,Timing - Click Count,name a sport player (any sport):,Timing - First Click,Timing - Last Click,Timing - Page Submit,Timing - Click Count,name a world leader:,Timing - First Click,Timing - Last Click,Timing - Page Submit,Timing - Click Count,name a building:,Timing - First Click,Timing - Last Click,Timing - Page Submit,Timing - Click Count,name a book:,Timing - First Click,Timing - Last Click,Timing - Page Submit,Timing - Click Count,name a television broadcasting organisation:,Timing - First Click,Timing - Last Click,Timing - Page Submit,Timing - Click Count,name a male football player:,Timing - First Click,Timing - Last Click,Timing - Page Submit,Timing - Click Count,name a cartoon:,Timing - First Click,Timing - Last Click,Timing - Page Submit,Timing - Click Count,name a recognisable chocolate brand:,Timing - First Click,Timing - Last Click,Timing - Page Submit,Timing - Click Count,name a music band:,Timing - First Click,Timing - Last Click,Timing - Page Submit,Timing - Click Count,name a date in the year:,Timing - First Click,Timing - Last Click,Timing - Page Submit,Timing - Click Count,name a mountain:,Timing - First Click,Timing - Last Click,Timing - Page Submit,Timing - Click Count,name a currency:,Timing - First Click,Timing - Last Click,Timing - Page Submit,Timing - Click Count,name a typical celebration:,Timing - First Click,Timing - Last Click,Timing - Page Submit,Timing - Click Count,name a female singer:,Timing - First Click,Timing - Last Click,Timing - Page Submit,Timing - Click Count,name a beach:,Timing - First Click,Timing - Last Click,Timing - Page Submit,Timing - Click Count,name a flight company:,Timing - First Click,Timing - Last Click,Timing - Page Submit,Timing - Click Count,name a typical dish:,Timing - First Click,Timing - Last Click,Timing - Page Submit,Timing - Click Count,name a typical flower:,Timing - First Click,Timing - Last Click,Timing - Page Submit,Timing - Click Count,name a sport:,Timing - First Click,Timing - Last Click,Timing - Page Submit,Timing - Click Count,name a tourist city:,Timing - First Click,Timing - Last Click,Timing - Page Submit,Timing - Click Count,Name the current president of the United States:,Score,,,,,,,,,,,,,,,,,,,,,,,,,,,,,,,,,,,,,,,,,,,,,,,,,,,,,,,,,,,,,,,,,,,,,,,,,,,,,,,,,,,,,,,,,,,,,,,,,,,,,,,,,,,,,,,,,,,,,,,,,,,,
